[
  {
    "id": "apple",
    "iconKey": "apple",
    "stackSize": 99,
    "rarity": "common",
    "tags": ["food", "fruit"]
  },
  {
    "id": "pear",
    "iconKey": "pear",
    "stackSize": 99,
    "rarity": "common",
    "tags": ["food", "fruit"]
  },
  {
    "id": "boar_chunk",
    "iconKey": "boar_chunk",
    "stackSize": 99,
    "rarity": "common",
    "tags": ["food", "meat"]
  }
]
